팀원들 모아서 와주세요.,チームを集めて来てください。
여자들이 축구를 하는 프로그램이에요.,女子たちがサッカーをするプログラムです。
어떤 어플리케이션 이실까요?,どんなアプリケーションでしょうか?
화질설정은 환경설정에 들어가면 조절이 가능합니다.,画質設定は、環境設定に入ると調節が可能です。
제품 입구 부분에 문제가 있습니다.,製品の入り口の部分に問題があります。
그걸로 해보겠습니다.,それにしてみます。
게임 관련한 테스트 프로그램 말씀이시군요.,ゲームに関するテストプログラムのことですね。
구체적으로 어떤 영상인지 말씀해주시겠습니까?,具体的には、どのような映像なのか教えてくださいませんか。
핸들이 약간 안맞아요.,ステアリングホイールは少し傾いています。
계좌번호 알려드릴까요?,口座番号をお教えしましょうか。
어떤 원단을 대량 공급 원하시나요?,どんな生地を大量供給したいですか?
저희 요금제 중에서는 가장 고객님께서 원하시는 것과 일치히네요.,我が社の料金プランの中では最もお客様のご希望と一致しますね。
예산은 얼마든지 들어도 좋습니다.,予算はいくらかかっても大丈夫です。
입금 해드리면 되나요?,入金すればいいですか?
어떤 부분이 궁금하세요?,どんな部分が気になりますか?
참 시국이 문제네요.,本当に時局が問題ですね。
원하는 쇼파의 크기는 얼마인가요?,必要なソファのサイズはいくらですか?
예약 인원은 몇 분이신가요?,ご予約は何人様でございますか。
그러니까요 뭔가 아이디어 회의를 해봐야겠어요.,そうですね、何かアイデア会議をしてみますね。
계약 내용 중 문의사항이 생겨서요.,契約の内容の中で、問い合わせたい事項ができまして。
"스틸강 구매했는데, 원료가 섞인것 같더라구요?",スチール鋼を購入しましたが、原料が混在しているらしいです。
시스템 상에서 확인해보니 주문하신 음식이 이미 조리에 들어간 상태라서 취소가 어렵습니다.,システム上で確認してみると注文された食べ物がすでに調理に入った状態なのでキャンセルが困難です。
미팅 날짜 잘 잡아 주세요 부탁드립니다.,打ち合わせの日程をよろしくお願いします。
출항하도록 하겠습니다.,出港させていただきます。
어떤게 궁금하신거죠?,どんなことが知りたいのですか?
기다릴게요 바로 보내주도록 해요.,待ちます。すぐに送ってください。
다시 운영할 수도 있나요?,また運営することもできますか?
계약서 보내드리겠습니다.,契約書をお送りします。
제가 좀 더 알아보고 다시 전화드릴게요.,私がもう少し調べてみて、改めてお電話します。
다음달 말까지면 가능할것같습니다.,来月末までには可能そうです。
주문번호는 SDS2920입니다.,注文番号はSDS2920です。
사용하고 계신 기종과 어플의 버전을 말해주세요.,お使いの機種とアプリのバージョンを教えてください。
저희 제품 광고 제작문의 드리려고 연락드려요.,うちの製品の広告の製作を問い合わせようと連絡します。
연예인에 따라 달라서요.,芸能人によって異なります。
급하시면 이전 버전 프로그램을 사용하고 계세요.,お急ぎでしたら、以前のバージョンのプログラムをお使いになってください。
8만원 미만으로 이 요금제들이 있는데 천천히 읽어보시고 결정해주세요.,8万ウォン未満では、このようなプランがあり、ゆっくりと読んでみて決定してください。
기한 내에 차질 없이 보내드리겠습니다.,期限内に支障がないようにお送りします。
어느 나라 언어로 제작하고 싶으신가요?,どの国の言語で製造したいですか?
제가 피부톤이 밝아서 밝은 제품으로 부탁드릴게요.,私は明るい肌色ですので、明るい製品でお願いします。
지금 문자로 보내드릴게요.,今、テキストでお送りします。
고객님 말씀하세요.,お客様、おっしゃってください。
현재 논의 중인 컨텐츠는 고민 중에 있습니다.,現在議論されているコンテンツは、悩んでいます。
결정되시면 연락주세요.,決定したらご連絡お願いします。
어떤 콘텐츠를 개발하려고 하시나요?,どんなコンテンツを開発しようとされてますか。
"강도나 길이, 단면모양 말씀해주세요, 저희 홈페이지 보시고 모델명 말씀해주셔도 됩니다.",強度や長さ、断面形状をお聞かせください、当店のホームページをご覧いただいて、モデル名をおっしゃっていただいても結構です。
아무래도 어렵죠.,確かに難しいですね。
서둘러 확인해주세요.,急いで確認してください。
"저희한테 매물이 2대 있습니다, 보시겠어요?",私たちのところに売物が2台ありますが、ご覧になりますか。
확인 후 도와 드리겠습니다.,確認の上、お手伝いします。
대출이 가능한지 확인해드릴게요.,貸し出しが可能か確認させていただきます。
그랬군요 다시 켜보고 안되면 알려주세요.,そうだったんですね、つけ直してみてダメだったら知らせてください。
팩스로 부탁드릴게요.,ファックスでお願いします。
패키지 프로그램으로 보여드리겠습니다.,パッケージのプログラムでお見せします。
18요금제로 바꿔드렸습니다.,18料金プランに変更しました。
그러시군요 잠시만요 확인하겠습니다.,そうですか、少々お待ちください、ご確認いたします。
깔끔하고 넓었으면 좋겠어요.,きれいで広いといいのですが。
15분 컷 가능합니다.,15分内にできます。
오늘 입금이군요 알겠습니다.,本日お振り込みですね、かしこまりました。
국산과 외제차 중에 어떤걸 보시나요?,国産車と外車ではどちらをご覧になりますか?
혹시 어디 부분인가요?,もしかして、どの部分ですか?
저희 회사에서 코나와 비슷한 차를 보여드릴게요.,弊社でコナに似たような車をお見せします。
마감일자를 조금 앞당길 수 있을까요?,締め切り日を少し早めてもらえますか?
터키어 영상이고 30분짜리입니다.,トルコ語の映像で、長さは30分くらいです。
화상 연결이 불안정하네요.,画像の連結が不安定ですね。
농수산물을 수출하고 싶어요.,農水産物を輸出したいんです。
기한은 언제까지 하면 될까요?,期限はいつまでにすればいいですか?
가능합니다 1차 완성본이 지금 막 나와서 테스트하고 있습니다 잘 다듬어서 보내드릴게요.,可能です、1回目の試作品がちょうど今出たのでテスト中です、丁寧に直してお送りします。
연비도 괜찮고 색상은 블랙과 화이트 두개입니다.,燃費もいいですし、色は黒と白の2色です。
높이 조절 가능한 책상 재고가 얼마나 있나요?,高さ調節可能なデスクの在庫はどれくらいありますか?
담당자에게 연락드리라고 하겠습니다.,担当者にご連絡するようにします。
점검 후 연락 부탁드립니다.,点検の後、ご連絡をお願いします。
작업도중에 자주 다운되는 현상이 발생합니다.,動作中にダウンすることがよくあります。
이번주는 다 괜찮습니다.,今週は全て大丈夫です。
제휴 희망하시는 드라마 목록을 보내주시겠습니까?,ご希望の提携ドラマの一覧を送っていただけますか?
원하시는 디자인이나 색상 있나요?,デザインや色のご希望はありますか?
아이디를 잃어버렸어요.,IDをなくしました。
여기 이 연관검색어들좀 다 삭제해주세요.,この関連検索語をすべて削除してください。
주문한 건 배송이 너무 오래 걸려서 취소 하고 싶습니다.,注文したものの配送に時間がかかりすぎなので、キャンセルしたいです。
아무래도 유저들이 너무 몰려서 과부하가 난 것 같습니다.,どうやら、ユーザーが殺到しすぎて過負荷になっているようです。
오전 중에 보내드린 메일 내용에 관해 이야기 나눠보고 싶어서요.,午前中にお送りしたメールの内容について話し合ってみたいのですが。
기업대출을 문의하려고 하는데요.,企業向けのローンを問い合わせようと思うのですが。
기업대출을 받으려고 합니다.,企業ローンを組みたいのですが。
기업으로 대출을 받고 싶어요.,企業から融資を受けたいのですが。
지난번 대출건에 대해 여쭤볼게 있어서요.,先日のローンの件に対してお聞きしたいことがありますが。
이번 가요프로그램에 mc를 뽑는다고 하던데.,今度の歌謡プログラムで司会を選ぶと言われましたが。
기업 플랫폼 관련하여 논의드릴 사항이 있어 연락드렸습니다.,企業のプラットフォームについて議論する事項があり、ご連絡しました。
저희 기업 제품을 스폰하고 싶어요.,弊社の製品を広告させていただきたいのですが。
코로나 때문에 취소하고 싶어요.,コロナのためにキャンセルしたいです。
새로운 이벤트를 할까해서요.,新しいイベントをしようと思っていまして。
화장품 성분 분석표 받을 수 있을까요?,化粧品の成分分析表をもらえますか?
저희 견적서 팩스로 보내주신다고 했는데 아직도 못 받아서요.,私どもの見積書をファックスで送ってくれると言ったのですが、まだ届いていないのです。
지난번에 말씀드린 기능성 섬유 샘플을 보내주실 수 있을까요?,先日お話しした機能性繊維のサンプルを送っていただけますか?
섬유 좀 공급받고 싶어서 연락 드렸습니다.,繊維の供給を受けたくて連絡しました。
보내주신 자료 잘 보았습니다.,送っていただいた資料はありがとうございました。
가구 제작 의뢰를 하려고요.,家具の制作依頼をしたいと思っているのですが。
장롱을 하나 주문제작 맡기고 싶어서요.,タンスを一つ、オーダーメイドを任せたいと思いまして。
지금 계획서 어디까지 작성됐나요?,今計画書はどこまで作成されたんですか?
자동차를 구입하려고 합니다.,車を買いたいのです。
여기도 자동차 시승 안돼는건가요?,ここも車の試乗はできないのでしょうか?
모닝 부품 구할 수 있을까요?,モーニングの部品をお願いできますか。
쏘나타를 사고 싶어요.,ソナタを買いたいです。
카달로그가 있으면 보고 생각할려고요.,カタログがあれば、見て考えたいと思います。
"저희 홈페이지에 공지되어 있습니다, 참고해 주세요.",当ホームページでお知らせしております、参考にしてください。
여러모로 장점이 많은 것 같군요.,いろいろメリットが多いようですね。
자동이체 희망하시는 해당 계좌번호를 알려주시겠습니까?,自動引き落としをご希望する該当口座番号を教えていただけますか?
일단 영상 바로 메일로 보내보겠습니다.,とりあえず、映像をすぐにメールで送ってみます。
그렇군요 그거 구매하고 싶어요.,なるほど、それを購入したいです。
금액이 얼마인가요?,金額がいくらですか。
회사 메일로 부탁드립니다.,会社のメールでお願いします。
그러면 진행 상황을 자세히 설명드리겠습니다.,それでは、進行状況を詳しく説明します。
지금 바로 넣어드릴께요.,すぐにお入れします。
신혼가구로 부탁드려요.,新婚家具でお願いします。
직접 수거 요청 해주셔야 합니다.,ご自身で引き取りをお願いしなければなりません。
면 종류로 보고 계신거죠?,麺の種類で見ていらっしゃいますよね?
저희는 로맨스 코미디에요.,私たちはロマンスコメディーです。
출고까지 얼마나 걸리나요?,出庫までどのくらいかかりますか?
메인화면에 있는 캐릭터 크기와 색상을 변경하고 싶습니다.,メイン画面のキャラクターの大きさと色を変更したいです。
어떤 부분에서 오류가 나는지 알려주실 수 있나요?,どの部分でエラーが出るのか教えてもらえますか?
구입하려는 차종이 있으신가요?,お買い求めの車種はございますか?
"따로 준비된 광고는 없고, 드라마나 예능 프로그램에서 PPL로 사용해 주셨으면 좋겠는데.",別に用意された広告はなく、ドラマや芸能番組でPPLとして使ってほしいのですが。
식탁을 좀 제작하려는데요.,食卓を製作しようと思いますが。
이것보다 진한 회색은 저쪽에 있습니다.,これより濃いグレーはあちらにございます。
도로로 나가볼까요?,道路に出てみましょうか?
아무래도 그렇겠죠?,さすがにそうでしょう?
괜찮을 거예요.,大丈夫だと思います。
다음주 수요일에 3시에 만납시다.,来週の水曜日の3時に会いましょう。
설명서 여기 있습니다.!,マニュアルがここにあります。
기간은 얼마나 걸리는지요.,期間はどのくらいかかるのでしょうか。
보이지 않네요.,見えませんね。
그럼 확인하고 말씀드릴게요.,では、確認してから申し上げますね。
"지금 처리했습니다, 확인해 주세요.",いま処理しました、確認してください。
작업 내용 보여드릴게요.,作業内容をお見せします。
제작기간은 한 일주일정도 걸릴것 같습니다.,製作期間は凡そ一週間ほどかかりそうです。
2천5백만원 정도요.,2千5百万ウォンくらいです。
심플한 디자인을 원해요.,シンプルなデザインが欲しいです。
아이디 복구 해드렸구요.,アイディーを復元させていただきました。
그럼 일단은 기다려 볼게요.,では、とりあえず待ってみます。
말씀하시면 신청해드릴게요.,言ってくだされば申し込んであげます。
모텔 정보 좀 저희 쪽으로 보내주실래요?,モーテルのインフォメーションをこちらに送っていただけますか。
그럼 확인 후 견적서 부탁드릴게요.,では確認してから見積書をお願いします。
어디에 제출하면 되나요?,どこに提出すればいいですか。
그럼 시간맞춰 오세요.,では、時間通りに来てください。
궁금한 건 그게 다예요.,気になるのはそれだけです。
먼저 본인 확인 부탁드립니다.,まず、本人確認をお願いします。
회원가입은 사이트에서 가능합니다.,会員登録はサイトからできます。
어떤 종류의 앱을 제작하고 싶은지 생각해보셨나요?,どんな種類のアプリが制作したいか考えてみましたか?
언어는 어떤 언어로 번역을 원하시는건가요?,言語はどの言語への翻訳をご希望ですか?
회사제품이 뭐죠?,会社の製品は何ですか。
드라마 협찬 가능한가요?,ドラマのスポンサー、できますか?
완료되면 바로 연락드릴게요.,完了しましたらすぐにご連絡します。
계좌로 보내겠습니다.,口座にお送りします。
이제 잘되는거 같아요.,もう大丈夫だと思います。
지금 종료하겠습니다.,いま終了します。
시간은 30분 내외입니다.,時間は30分前後です。
제품 소개서를 이메일로 보내드려도 될까요?,製品の紹介書をメールでお送りしてもよろしいですか?
제가 알람을 확인을 못했네요.,私はアラームを確認できませんでした。
프랑스어로 번역하려고 합니다.,フランス語に翻訳したいのですが。
모닝 매물은 이쪽에 있습니다.,モーニングの売り物はこちらにあります。
어떤 가구를 생각하시는건가요?,どのような家具をお考えですか?
가구는 딱히 최저 수량은 없습니다.,家具は特に最低数量はありません。
3개도 가능합니까?,3個もできますか?
매트리스 아래쪽으로 서랍이 있는 형태 찾으시는 걸까요?,マットレスの下側に引き出しがあるタイプでお探しでしょうか?
"비밀번호 변경하시구요, 이중 로그인 설정 추천드립니다.",パスワードの変更してください、二重ログインの設定をお勧めします。
그럼 작업완성되면 연락주세요.,では、作業ができましたらご連絡ください。
제가 시간 날 때 연락드릴게요.,私が時間がある時に連絡致します。
금요일 오후로 잡아 주세요.,金曜日の午後にしてください。
번역하는데 얼마나 걸리나요?,翻訳するのにどれくらいかかりますか?
간단한 문항들로 진행 됩니다.,簡単な問題で行われます。
침대랑 수납장을 제작 하려구요.,ベッドと収納棚を作りたいです。
그럼 지금 바로 시작할까요?,では、早速始めましょうか。
저희 제품은 드라마입니다.,うちの製品はドラマです。
쇼파를 제작하고 싶어요.,ソファを作りたいんです。
화상 영어는 처음 하시는걸까요?,ビデオ通話の英語勉強は初めてなのでしょうか?
유지보수는 OTT 플랫폼에서 제공하지 않습니다.,メンテナンスはOTTプラットフォームでは提供しません。
다시 생각해보고 연락할게요.,もう一度考えてから連絡します。
다른 직원 불러드릴께요.,ほかのスタッフを呼んできます。
정확한 사이즈를 말씀해 주셔야 합니다.,正確なサイズを言ってください。
이상없는 영상입니다.,異常のない映像です。
그럼 바로 연결해드리겠습니다.,では、すぐにおつなぎします。
네네 그럼 바로 구입하겠습니다.,はいはい、では、早速購入します。
원하시는 수량을 말씀해 주세요.,ご希望の数量をお聞かせください。
다른 언어 어떤걸 말씀이시죠?,ほかの言語はどんなことをおっしゃっていますか。
근처에 고깃집이나 가죠.,近くの焼肉屋でも行きましょう。
그럼 나중에 필요하실 때 다시 연락 주세요.,では、後で必要になったときにまたご連絡ください。
혹시 어떤 제품일까요?,もしかしてどんな製品でしょうか?
20개 는 너무 많은 거 같은데요.,20個は多すぎると思います。
강사분을 제가 고를 수 있나요?,インストラクターの方を私が選べますか?
원하시는 분 고르면 됩니다.,お好きな方をお選びください。
원격으로 도와주실 수 없나요?,遠隔で助けてもらえませんか?
니트소재로 제작 부탁드려요.,ニット素材で製作をお願いします。
그럼 내일 쯤 도착하나요?,では、明日頃届きますか?
신원확인 먼저 해드리겠습니다.,身元の確認を先にさせていただきます。
그럼 얼마가 적당한가요.,じゃい適切な値段はいくらですか?
그럼 확인후 연락 주세요.,では確認してご連絡ください。
그럼 어두운 계열로 보여드릴게요.,では、ダーク系でお見せしましょう。
바로 확인해서 알려드리겠습니다.,すぐに確認してお知らせします。
5~10분내외로 걸릴것같아요.,5~10分前後かかると思います。
그럼 확인하시고 방문해 주세요.,では、ご確認の上ご来店ください。
고급반 선생님으로 변경 가능할까요?,上級クラスの先生に変更できますか?
다음주 월요일까지 보내는 발주건이요.,来週月曜日までに送る発注の件です。
9시까지 방문 드리겠습니다 감사합니다.,9時までお伺いします、ありがとうございます。
뭐가 감사하다는 걸까요?,どのような事で感謝しているのでしょうか?
그럼 견적서를 보내주시겠어요?,では、見積書を送っていただけますか?
의상 갖고 바로 와주세요 그럼.,衣装をすぐ持ってきてください。
사업자등록증이랑 신분증 가져오셨나요?,事業者登録証と身分証明書をお持ちですか。
설명해주시면 감사하겠습니다.,説明してもらえると助かります。
그럼 다음주 목요일로할께요.,では、来週の木曜日にします。
요즘은 과일 소주가 인기가 많아요.,最近は果実焼酎が人気があります。
내일까지 준비해서 보내드리겠습니다.,明日まで用意してお送りします。
이메일로 첨부해서 보내드리겠습니다~,メールに添付してお送りします~
저희 연구의 결과물 입니다.,私たちの研究の結果物です。
공급가는 개당 70원입니다.,供給価は一個あたり70ウォンです。
"뭐,,네 알겠습니다.",まあ..はい、わかりました。
PPL 맞습니다.,間接広告合ってます。
이게 끝이에요.,これで終わりです。
정말 기술 좋아졌네요.,本当に技術が良くなりましたね。
죄송하지만 이 차종은 흰색보다는 진주펄 색 있습니다.,申し訳ございませんが、この車種は白よりはパールカラーがございます。
그럼 다시 집에가서 가지고올께요.,では、また家に帰って持ってきます。
그럼 나중에 다시 방문해주세요.,では、あとでまたお越しください。
물론이지요 여기 샘플을 가지고 왔습니다.,もちろんです、サンプルをお持ちしました。
그럼 어쩔수없네요 다음에 다시 연락드리겠습니다.,それでは仕方がないですね、また今度ご連絡します。
여기서 장난치시면 안됩니다 신분증 부탁드립니다.,ここでふざけないでください、身分証をお願いします。
이번 소개한 제품은 매우 빠릅니다.,今回に紹介した製品はとても早いです。
일단 저희 책자도 있으니 이거 보면서 상세하게 말씀 드리겠습니다.,一応、弊社のパンフレットもありますので、こちらを見ながら詳しく説明いたします。
그럼 전기차로 보여드릴게요.,では、電気自動車をお見せしましょう。
10분동안 유창하지는 않아도되지만 자유롭게 영어로 대화해주세요.,10分の間、流暢でなくていいですが、自由に英語で会話してください。
무슨 시간 말씀하시나요?,何の時間のことでしょうか。
이벤트 중인가봐요?,イベント中のようですね?
어떻게 보상해주실 건가요?,どうやって報償してもらえますか?
연락 바로 드릴게요.,すぐに連絡します。
식탁을 의뢰하고 싶은데 가능할까요?,食卓を注文したいのですが、可能でしょうか?
1시간 내로 연락 드리겠습니다.,一時間内に連絡いたします。
별도의 창고에 있습니다.,別の倉庫にあります。
어느 정도 있나요?,どのくらいあるんですか?
"마티즈 , 아토즈 같은 그런 경차 신제품 있나요?",マティズやアトスのような軽自動車の中で新商品はありますか?
생각하시고 말씀해 주세요.,考えてからおっしゃってください。
레벨테스트가 필요하겠네요.,レベルテストが必要になりますね。
금방 갔다가 나올게요.,すぐ行ってきます。
그럼 시나리오가 짜여지면 다시 말씀해주시겠어요?,では、シナリオが組まれたら、もう一度おっしゃっていただけますか?
아닙니다 저희 홈페이지에서 기업회원가입하시면 편하게 가능하세요.,いいえ、私どものホームページから企業会員に加入していただければ楽にできます。
그러면 다음 주에 마케팅팀이랑 같이 홍보 아이디어 미팅해봐요.,では、来週マーケティングチームと一緒に広報アイデアの打ち合わせをしてみましょう。
언제까지 기다려야 합니까?,いつまで待てばいいですか。
제가 부른 게 아닌 것 같은데요.,私が呼んだのではないと思います。
오해하게 해드린점 죄송하다는겁니다.,誤解させてしまったことをお詫びします。
네네 아닙니다 수고하세요.,はいはい、そんなことないです、ご苦労さまです。
그럼 중간에 마시는 장면을 넣도록 하죠.,では、途中で飲むシーンを入れることにしましょう。
해결 부탁드려요.,解決をお願いします。
혼란을 드려 죄송하네요.,ご迷惑をおかけしまして申し訳ございません。
그럼 이따가 알려주세요.,では、あとで教えてください。
"천만원대는 몇 대 없는데, 보여드릴게요.",一千万ウォン台はあまりありませんが、お見せいたします。
