앉아서 좀만 기다려주세요.,おかけになって少々お待ちください。
저기 화장실이 어디있나요?,あの、トイレはどこですか?
부산이 짱이에요.,釜山が一番です。
농담이고 식단까지 잘 짜드릴게요.,冗談ですし、メニューまでよく作りますよ。
혹시 매점은 어디에 있나요?,ちなみに売店はどこにありますか?
허리에 무리 안 가게 준비운동부터 하죠.,腰に無理がかからないように準備運動からしましょう。
"아뇨, 스트레칭부터 해주셔야 합니다.",いいえ、ストレッチからしてください。
타고 남산 돈까스도 먹을거에요.,乗って南山のとんかつも食べます。
그럼 지금 버스를 탈까요?,では、今からバスに乗りましょうか?
오랜만에 하는 데이트인데 조금 서운하다.,久しぶりのデートなのにちょっと寂しい。
친절하신 분이네요 감사합니다.,親切な方ですね、ありがとうございます。
오냐 아 그럼 나 가방 좀 잠깐 들어주라.,うん、私のカバンをちょっと持ってくれ。
그치그치 그렇게 하면되!,そうそう、そうすればいいんだ!
나 향수도 좀 사야하는데.,私、香水も買わなくちゃ。
다음에 랍스터 먹으러 가야겠다.,今度ロブスターを食べに行くよ。
내일 아침 10시 표로 2장 주세요.,明朝10時のチケットを二枚ください。
쳇 그런거냐 아쉽네 얻어먹으려고 했는데.,ちっ、そういうことか惜しい、おごってもらおうと思ったのに。
그것만 시키면 되는거야?,それだけ頼めばいいのか?
우리 둘째날 가볼까?,私たちは2日目に行ってみようか。
안주는 뭘로 드릴까요?,おつまみは何になさいますか。
아마 될거야.,たぶんできる。
꼭 챙겨!,必ず取りそろえて!
여기 반찬이 맛있어서 또 사러올께요.,ここのおかずが美味しかったので、また買いに来ます。
겨울은 안왔으면 좋겠어.,冬は来ないといい。
지금 버거킹으로 가서 주문하자.,今からバーガーキングに行って注文しよう。
예매하고 있을게 다녀와.,予約してるから、行ってきて。
나도 그래 왜 그럴까 모르겠어.,私もそうなんだ。なんでそうなのか分からない。
가서 정하는 걸로 하자.,行って決めることにしよう。
세수만 하고 올게~,顔を洗ってくるよ~
저거 타고 한 번 가보자~,あれに乗って一度行ってみよう〜
들어가는 재료가 꽤 많네요.,入る材料が結構多いですね。
그래도 여기까지 왔는데 조식은 먹어야지.,それでもここまで来たのに朝食は食べなければ。
"꾀병이라니, 무슨 말을 그렇게 해.",仮病とは、どういうことですか。
배를 타시면서 칵테일도 즐길 수 있어요.,船に乗りながらカクテルも楽しめます。
유럽 패키지는 거의 7시부터 일정이 시작돼.,ヨーロッパパッケージはほとんど7時から日程が始まるよ。
그렇구나 그렇구나 스카프나 사러 가자.,そうか、そうか、スカーフでも買いに行こう。
오른쪽으로 가신 후 스타벅스 매장 왼편에 있습니다.,右に行って、スターバックスの左側にあります。
젊을 때야 이럴 수 있으니 맘껏 돌아댕겨보자.,若いときにはこうすることができるから歩き回ってみよう。
너는 어떤거 사려고?,あなたは何を買うつもりなの?
다리운동부터 시작해보자.,足の運動から始めよう。
나는 우선 시원한 맥주 한 캔 먼저 마셨으면 좋겠어.,私はとりあえず、冷えたビールを一本飲みたい。
25개씩 3세트 했어!,25個ずつ3セットやった!
나도 화장품부터 살거야.,私も化粧品から買う。
코토는 몇살이에요?,コトはいくつですか?
너는 돌아다니는 걸 싫어하니까 호캉스가 맞긴 하겠다.,君は歩き回るのが苦手だから、確かホカンスに合いそう。
와 잘되었다 얼른 한라산 가자.,わー、よかった。早くハンラサンに行こうよ。
밥 먹을 시간은 없겠지?,ご飯を食べる時間はないだろうね。
알았어 근데 뭐 사줄거야?,分かった、でも何を買ってくれる?
바나나 3천원입니다.,バナナ3千ウォンです。
줄 기다리고있어 얼른다녀올게.,並んでいて、早く行ってくる。
저거 부터 타자.,あれから乗ろう。
나먼저 씻고 나올게.,私、先にシャワーしてくるよ。
불고기 먹을까?,プルゴギ食べようか?
오케이 김치찌개 좋아.,オーケー、キムチチゲいいよ。
불고기 먹어보고 싶네.,プルコギ食べてみたいな。
김치찌개 맛있겠다.,キムチチゲおいしそう。
인기제품이라 올때마다 없었거든요.,人気商品なので、来るたびになかったんです。
저기 있는 카페가는 거 어때?,あそこのカフェに行くのはどう?
맞아요 특가가 있어서 다행이네요.,そうですね、特価があって良かったですね。
방이 마침 있습니다 총 6분 방세개 예약 도와드리겠습니다.,部屋がちょうどあります、合計6名様に三つの部屋のご予約を手伝いたします。
드디어 네가 데이트비용을 내는 날이 오는구나.,ついに君がデートの費用を払う日が来るんだな。
그래.그럼 밥 먹고 갈래?,そうだね、じゃあご飯食べていく?
구미에서 경주는 가깝나요?,亀尾から慶州は近いのですか?
조금만 더 가면 여기서 유명한 식당이 있대.,もう少し先に行くとここで有名なレストランがあるそうよ。
가까운 편이에요 가보실려구요.,近いほうですよ、行ってみようと思います。
오늘은 내가 다 낼게 걱정 마.,今日は私が全部出すから心配するな。
어후 너무 좋아 서브웨이.,ああ、大好きだよ、サブウェイ。
너는 여전히 아기자기한거 좋아하는구나.,君は未だにこまごまとしていてかわいい物が好きなんだね。
나 시간 있어.,私は時間あるわ。
새로 나온 메뉴면 앞에서 판촉을 하고 있겠지.,新メニューなら、店頭で販促をしているだろう。
오늘은 체력이 넘칠거에요.,今日は体力がみなぎるでしょう。
저도 날씨가 너무 좋아서 나왔어요.,私も天気がとても良かったので出かけました。
오늘은 바다를 보러 가려고해요.,今日は海を見に行こうと思っています。
자 이렇게 천천히 따라해보세요.,どうぞ、このようにゆっくり真似してみてください。
나는 누나한테 부탁받은 화장품 사야해.,私は姉に頼まれた化粧品を買わなければならない。
저번 여행때 호텔에 여권을 두고와서 고생했었지.,この前の旅行の時、ホテルにパスポートを忘れてきて苦労したよね。
뚱카롱도 오늘 만들 수 있나요?,太ってるカロンも今日作れるんですか?
날씨 쌀쌀하니 목도리 챙기는거 잊지마.,天気が肌寒いからマフラーを忘れないで。
여기는 핫도그 유명한 가게가 근처에 있어.,ここにはホットドッグの有名店が近くにある。
내 생각이 짧았어.,私の考えが浅かった。
벌써부터 입에 침이 고이는데.,もう口に唾液がたまってくる。
음료수는 하나만 시킬까?,飲み物は一杯だけにしようか。
"아,그랬군요.지금은 많이 괜찮아졌나요?",ああ、そうだったんですね。今はだいぶ良くなっていますか?
열심히 공부했구나!,一生懸命に勉強したんだね!
오늘은 피곤해.,今日は疲れた。
"그러게, 요즘 자꾸 이상하게 말하네.",そうよね、最近よく変な話をしたりするよね。
버터는 어느정도 사용하나요?,バターはどれくらい入れますか。
중간중간 먹을 거는 챙겼어?,途中に何か食べ物持った?
저번에 가보니까 공항에도 있더라 맘스터치로 가자 그럼.,この前に行ってみたら空港にもあったよ、ではマムズタッチに行こう。
두개로 나눠 결제하고 싶네요.,2つに分けて支払いたいですね。
보너스도 받았으니 이번에 한 번 질러야지~,ボーナスももらったんだから、今回は一度大きく使わないと~
나는 콜라 아니면 환타 먹을꺼야.,私はコーラかファンタを飲む。
건강한 편이긴한데 병원에선 조금 빼라고 권유하더라고요.,健康な方ではありますが、病院からは少し痩せろと勧められました。
명심까지하지않아도 되요!,心掛けまでしなくてもいいですよ!
배우는게 즐겁네요.,学ぶのが楽しいですね。
밥도 네가 사는 걸로 하자.,ご飯も君がおごることにしましょう。
그냥 검색해보거나 식당에 들어가서 쉐프한테 물어보는편이 좋을것 같은데?,ただ検索してみるか、食堂に入ってシェフに聞いてみたほうがいいと思いますが?
"좋아, 영화는 내가 쏘도록 할게.",よし、映画は私がおごるとしよう。
"근데 나 줄넘기가 없는데, 혹시 너 안쓰는 줄넘기 있어?",でも私、縄跳び持ってないけど、君って使ってない縄跳びある?
영수증 잃어버렸는데 방법이 없나요?,領収書を失くしてしまったんですが、別の方法はありませんか?
나는 아이스 카라멜 마끼아또 마셔야지.,私はアイスキャラメルキャラメルマキアートにしようと。
그러게여 선생님 다시는 보지마요.,そうですね。先生、もう二度と見ないでください。
"오늘은 내가 다 영어로 얘기 할 테니까, 너는 잘 따라오기만해.",今日は私が全部英語で話すから、あなたはついてくるだけでいいよ。
이쁜 카페에 가자!,かわいいカフェに行こう!
내가 검색해놨지.,私が検索しておいた。
뭔가 오해가 있는것같은데.,なにか誤解があるみたいだけど。
난 네 뒷담 깐적없어.,私はあなたの悪口を言ったことがない。
어떤 방으로 예약하시겠어요?,どのお部屋をご予約なさいますか?
스위트룸 어른 두분에 아이한명 1박 예약 되셨구요 결제는 바로 해드릴까요?,スイートルームを大人2名様にお子様1名様で一泊のご予約を承りました、お会計の方も今お手伝いしましょうか?
너가 예매좀 해줘.,お前が予約してくれ。
농담이지 농담.,冗談だよ、冗談。
초코파이는 오리온이 더 인기 많아요.,チョコパイはオリオンのほうが人気があります。
경복궁 근처에 가면 한복 대여점이 많이 있대.,景福宮の近くに行けば、韓服レンタル店がたくさんあるそうだ。
와 정말 완벽하게 준비했네.,わ、本当に完璧に準備したね。
또 언제 미국 와보겠냐.,またいつ米国に来れると思うんだ。
이게 다 좋은 경험이지 사진도 많이 찍자.,これも全部良い経験だよ。写真もたくさん撮ろう。
걱정 넣어두셔요~ 베이킹에 소질이 있을 것 같은 느낌적인 느낌이 듭니다.,心配はいりませんよ~ベーキングに素質がありそうな感じがします。
나 간단히 과자라도 먹고 있을게.,私は軽くお菓子でも食べているね。
등근육은 랫풀다운을 해보세요.,背筋はラットプルダウンをしてみてください。
우리는 너무 천천히 먹는 것 같아.,私たちはとてもゆっくり食べているみたい。
자세 좀 알려주시겠어요.,詳しく教えていただけますか。
먼저 들어가서 기다리자.,先に入って待とう。
우리 오늘 부산으로 가기로 했잖아.,私たち今日釜山に行くことにしたんじゃない。
사야 하는 거는 지갑이지.,買うべきは財布だよ。
방 청소는 언제 언제 하죠.,部屋の掃除はいつ、いつやりましょうか。
샘플을 보고 결정해도 될까요?,サンプルを見て決めてもいいですか?
"이달의 아트 하고 싶은데, 색상이나 약간의 디자인 변경 가능할까요?",今月のアートにしたいのですが、色やちょっとしたデザインの変更はできますか?
난 매콤한 떡볶이 먹을래.,私は辛いトッポギ食べる。
우리 기차타고 논산가기로 했잖아.,私たち電車に乗って論山に行くことにしたじゃないのか。
울산에서 유명한 국밥집이 있다고 했었어 거기 가자.,蔚山で有名なクッパ店があると言っていたから、そこへ行こう。
우리나라에 없는 화장품을 사야지.,私の国にない化粧品を買わないと。
예약했는데 체크인해주세요.,予約してあるのですが、チェックインしてください。
흠.모르겠는데 찾아보자.,うーん。わからないけど、探してみよう。
돈가스 먹어보고싶은데!,とんかつを食べてみたいんだけど!
비빔밥이랑 콩국수가 맛있을 것 같아.,ビビンバとコングックスが美味しそうだ。
영화 우리 자주 봤는데 또 봐?,私たち、かなりの頻度で映画を見に行ってるけど、またなの?
영화보자.뭐 보고싶어?,映画を見よう。何が見たい?
젤네일 지우고 새로 하고 싶어요.,ジェルネイルのオフして新しくやりたいです。
최대한 화려하게 부탁드려요.,できるだけ派手にお願いします。
부모님이랑 형 선물 사려고.,両親と兄へのお土産です。
그치 여기 너무 좋은거 같다~,そう、こことてもいいと思うー
얼른 주문부터 하자.,早く注文からしよう。
B5 좌석은 여기서 쭉 가다가 저기 저 파란색 간판 같이 생긴곳에서 왼쪽으로 돌면 됩니다.,B5の座席はここからまっすぐ行って、あそこのあの青い看板のようなところで左側に曲れば結構です。
오른쪽으로 쭉 가셔서 보이는 B구역에서 5번째 자리입니다.,右へまっすぐ行って、Bエリアの5番目の席です。
나는 양주랑 담배 살거야.,私は洋酒とタバコを買う。
할머니 선물 사려고~!,おばあちゃんのおみやげ買おうとー!
마카롱은 안에 들어가는 꼬크가 제일 중요해요.,マカロンは中に入るコックが一番重要です。
그러게 어디에 음식점들이 있는지 찾아보자.,そうだね。飲食店がどこにあるか探してみよう。
왜 제때 안 왔어.,どうして時間通りに来なかったの。
어디 찾으시는건가요?,どこをお探しでしょうか?
이동네 사람이 어디든 잘 알아요.,この町の住人の方がどこでもよく知っていますよ。
어딜 가려고 하시는데요?,どこへいらっしゃるご予定でしょうか。
어떤일을 도와드릴까요?,ご用件は何でしょうか?
치즈떡볶이 1인분이랑 순대 1인분 주세요.,チーズトッポギを一人前とスンデを一人前ください。
"안녕하세요, 베이킹 클래스 등록하려고하는데요.",こんにちは、ベーキングクラスの登録をしたいのですが。
안녕하세요 고등어가 어디에 있어요?,こんにちは、サバはどこにありますか?
"나야 좋지, 근데 코로나 때문에 영화관 닫지 않았을까?",私はいいよ。でも、コロナの影響で映画館は閉まっているのではないかな?
오늘은 2 단줄넘기요.,今日は2段跳びです。
반가워요 저는 커피를 좋아하는 티나에요.,はじめまして、私はコーヒーが好きなティナです。
나 백화점 가서 화장품 좀 구경하고 싶어.,私、デパートに行って化粧品をちょっと見てみたい。
좌측으로 쭉 걸어가시면 있습니다.,左にまっすぐ歩かれるとあります。
그래도 여름이니까!,でも夏だから!
진짜 창렬하다.튀김도 몇개 안줘.,本当にコスパが低い。天ぷらもあまりくれない。
나 할래.,私、やる。
국산이 더 고소하고 좋아여.,国産の方が香ばしくていいですよ。
가격은 상관없어요 알려주세요.,値段は構いません、教えてください。
그래서 그런지 즐거워 보이네요.,だからか、楽しそうですね。
무거우니까 조심히 들고.,重いので気をつけて持って。
고객님 그러면 첫 트레이닝 예약 일정은 언제가 편하세요?,お客様、でしたら初回トレーニングの予約日程はいつがご都合がよろしいですか?
매운 맛은 조절할 수 있다며?,辛さは調整ができるって?
안맵게도 할 수 있을걸?,辛くないようにできるだろう。
네.정말 공기도 좋고 구경할곳도 많아요.,はい。本当に空気もいいし、見どころもたくさんありますよ。
자 일단 손씻고 밀가루반죽 시작해볼께요~,さて、まず手を洗って小麦粉をこねることから始めましょう~
일단 검색 좀 해보자.,とりあえず検索してみましょう。
우리 밥먹고 수영이나 하자.,私たち、ご飯を食べて泳ぎでもしよう。
나는 무조건 크림이야!,俺は絶対にクリームだ!
나중에 룸서비스도 시켜먹자.,後でルームサービスも頼みましょう。
그만큼 쎄게 던졌다는거지.,それだけ強く投げたということだ。
그건 무슨 내용이야?,それはどういう内容なの?
갈치가 참 싱싱해 보이네요.,タチウオがとても新鮮そうですね。
나도 걱정은 되는데 괜찮을거야.,私も心配だけど大丈夫だろう。
사실 뭐가 유명한지 잘 모르는데.,実は何が有名なのかよくわからないのですが。
니가 먼저 계속 별것도 아닌걸로 잔소리했잖아.,あなたが先にずっと大したことでもないことに小言を言ったじゃないか。
랜드마크지 여기도~ 한번 올라가볼까?,ランドマークだねここも~一度上がってみる?
그래.시간이 벌써 이렇게 됐네.얼른가자.,そうだね。もうこんな時間になったねですね。早く行こう。
참 줄넘기였지?,本当に縄跳びでしたね。
몇개나 사야하는거야?,何個くらい買わなきゃいけないの?
얼른 골라봐~!,早く選んで~!
와우 대박이군요 너무 귀여워요.,わあ、すごいですね、とてもかわいいです。
오케이 그럼 나이키 매장부터 가자.,オーケー、じゃあナイキ売り場から行こう。
금방 드릴게요.,すぐにお渡しします。
혼자 자유여행 왔어요.,一人で自由旅行で来ました。
에휴 이제 뭐 먹고 살아야하나.,ふぅ、これからは何を食べて暮らしていけばいいのかな。
사실은 나도 잘 몰라.,実は私もよく知らない。
산책은 하루에 한번 하시는 건가요?,散歩は一日一回されるんですか?
난 제로콜라 마실래.,私はゼロコーラにする。
엘레베이터는 어디 있나요?,エレベーターはどこにありますか。
이런 인연이 있네요!,こんな縁があるんですね!
순대도 하나 더 추가해서 시키자.,スンデももう一つ追加して注文しよう。
뛰어야 하나?,走らなきゃいけないかな?
결제 끝나면 전화할게.,支払いが済んだら電話します。
자기 그래도 돼?,あなたそれでもいいの?
빨리 먹고 가서 좀 쉬자.,早く食べ終えてちょっと休もうよ。
보비 안녕.,ボビ、こんにちは。
가래떡이라고 불러!,カレトックと言うの!
이게 가래떡이라고?,これがカレトクだって?
아울렛 가는 버스가 몇번이라고 했더라.,アウトレットに行くバスが何番って言ったっけ。
짐 여기 두었구요~ 편안한밤되세요.,荷物をここに置きました〜おやすみなさい。
그런데 너가 힘들다고 맨날 안나오잖아~,しかし、あなたが大変だといつも出てこないじゃないですか~
저기요 여기 양이너무 작은거아닌가요.,あのう、ここ、量が小さすぎませんか?
여기가 괜찮은거같아 들어갈까.,ここがいいと思う、入ってみる?
너만 바쁘니?,忙しいのはあなただけと思っている?
우리 집에서 보자.,私の家で会おう。
이거랑 뭐 시킬까?,これと何を頼もうか?
이번에 행사중이어서 1+1 4900원입니다.,今回はキャンペーン中なので、1+1 4900ウォンです。
혹시 배달도 가능한가요?,もしかして、配達もできますか?
3000원 추가 금액은 퇴실 시 결제 하시면 됩니다.,3000ウォンの追加金額は、退室時にお支払いいただくければよろしいです。
나는 스시 먹고싶어.,私はお寿司が食べたい。
우리 같이 카페가서 맛있는 거 먹자.,私たち、一緒にカフェに行っておいしいものを食べよう。
재밌는 관광 되세요.,観光を楽しんできてください。
뭐 그럴 수도 있지.,まあ、そんなこともあるよ。
참외세개에 오천원입니다.,うり三個で五千ウァンです。
피자빵 50개 가능합니다.,ピザパン50個はできます。
먼저 찾는 사람이 말해주기로 하자.,先に探した人が言ってくれることにしよう。
뭐 어쩌라고 싸울까?,何をどうしろと、戦うか?
그러면 밤식빵은 남았나요.,では、栗食パンは残っていますか?
우리 아직 저녁 안먹었잖아.,私たちまだ夕食をとってないじゃない。
혹시 해보시고 어려우시면 저희에게 다시 연락주세요.,試してみて、もし難しいようでしたら、また連絡してください。
요즘 유행하는 스타일로요.,今時のはやりのスタイルでですね。
내일은 받아보실 수 있습니다.,明日にはお届けできます。
린넨으로 보고 있습니다.,リネンで見ています。
어떤 악기인지 말씀해주세요.,どのような楽器なのか教えてください。
어떤 음료인지 제품에 관한 자료 보내주세요.,どんな飲料か製品に関する資料を送ってください。
주문번호 알려주시면 확인해드릴게요.,注文番号を教えてくだされば、確認させていただきます。
아뇨 원격으로 진행됩니다.,いいえ、それは遠隔で進行されます。
오늘은 배달이 상당히 빠르네요.,今日は配達がかなり速いですね。
상태에 따라 20분 내외로 끝나는 경우도 있고 훨씬 오래 걸리는 경우도 있습니다.,状態に応じて20分前後で終わる場合もあり、はるかに時間がかかる場合もあります。
해외송금하려고 합니다.,海外送金をしたいんですが。
그러면 다음에 뵙겠습니다.,では、今度伺わせていただきます。
수량은 구체적으로 몇개나 원하시나요?,数量は具体的にいくつご希望ですか。
잘 포장해서 보내주세요.,よく包装して送ってください。
혹시 물건 가격 이외에 배송 비용과 설치 비용을 따로 지불해야 하나요?,もし、商品価格以外の配送費用と設置費用を別々に支払うべきですか?
일단 재부팅 해보고 다시 연락드릴게요.,とりあえず再起動して、改めてご連絡いたします。
일단 불편을 드려서 죄송합니다.,まず、不便をおかけしまして申し訳ございません。
대표님 잠시만 기다려 주시면 감사하겠습니다.,代表様、しばらくお待ちしていただけたらありがたいです。
다른 제품으로 교환해드리겠습니다.,別の製品に交換します。
바로 진행할 수 있나요?,すぐ進めることができますか?
관련부서로 안내해드릴게요.,関連部署にご案内いたします。
앞으로 할인 계획도 없나요?,これから割引の計画もありませんか?
바로 조치해드리겠습니다~,すぐにご対応いたします~
"아니요, 잠시만요.",いいえ、ちょっと待ってください。
수락 누르겠습니다.,受諾を押します。
말씀해 주시면 팀장님과 논의 후 연락드리겠습니다.,話していただければ、チーム長と話をしてから、連絡します。
이해합니다 언제로 날짜 변경할까요?,理解します、日付はいつに変更しましょうか?
사이드미러 좀 구매 하려고 합니다.,ドアミラーをちょっと買いたいのですが。
괜찮습니다 그때 뵙겠습니다.,大丈夫です、その時にお目にかかります。
먼저 저희 컨텐츠에 관심 가져주셔서 정말 감사합니다.,まず、弊社のコンテンツに興味を持っていただいてありがとうございます。
자세한 사항을 듣고 싶은데 만나서 미팅 가능하실까요?,詳細を聞きたいのですが、会って打ち合わせできましょうか。
최대한 빨리 하겠습니다.,できるだけ早くします。
200장 정도 생각합니다.,200枚くらいを考えています。
어떤 대리님 찾고 계시죠?,どの代理を探していますか?
기본효과만 있으면되요.,基本効果だけあれば良いです。
물품 변경한다고 연락받았습니다.,物品変更すると連絡を受けました。
궁금하신 섬유가 있으신가요?,気になる繊維はありますか?
어떤 어플일까요?,どんなアプリでしょうか?
한번 둘러보도록할게요.,一度見てみます。
